repo_name,language,stars,type,content,url,category
Azure/PyRIT,Python,2034,pull_request,feat: explicitly initialize central memory + remove defaults,https://github.com/Azure/PyRIT/pull/616,space
Azure/PyRIT,Python,2034,pull_request,[draft] refactoring scores in memory,https://github.com/Azure/PyRIT/pull/614,space
Azure/PyRIT,Python,2034,pull_request,maint add support for local multimodal input prompts when using azuresqlmemory,https://github.com/Azure/PyRIT/pull/613,space
lucidrains/toolformer-pytorch,Python,1985,pull_request,api_stop in invoke_tools has extra space,https://github.com/lucidrains/toolformer-pytorch/pull/20,space
bghira/SimpleTuner,Python,1969,pull_request,deepspeed stage 3 needs validations disabled thoroughly,https://github.com/bghira/SimpleTuner/pull/1243,time
bghira/SimpleTuner,Python,1969,pull_request,accelerate: from v0.34 to v1.2,https://github.com/bghira/SimpleTuner/pull/1228,time
bghira/SimpleTuner,Python,1969,pull_request,deepspeed from 0.15 to 0.16.1,https://github.com/bghira/SimpleTuner/pull/1227,time
InternLM/lagent,Python,1944,pull_request,[feat] support resetting agent memory recursively or by keypath,https://github.com/InternLM/lagent/pull/271,space
IAHispano/Applio,Python,1942,pull_request,devin/1734539214 fastapi vertex integration,https://github.com/IAHispano/Applio/pull/918,time
NVIDIA/Stable-Diffusion-WebUI-TensorRT,Python,1935,pull_request,use cupy to accelerate,https://github.com/NVIDIA/Stable-Diffusion-WebUI-TensorRT/pull/214,time
google-gemini/generative-ai-python,Python,1932,pull_request,add whitespace to generated tables to fix markdown in tables.,https://github.com/google-gemini/generative-ai-python/pull/602,space
